Authors;Title;Year;Volume;Issue;Start Page;End Page;Abstract;DOI;Author Keywords;Publication Title;Link;Database;Title_lower
B. Bouvarel and N. Lapidus;CO11.1 - Causal inference by generation of synthetic data from electronic health records as an alternative to inverse probability of treatment weighting: a simulation study;2025;73;Desconocido;203024;Desconocido;"Background and objective(s)
Causal inference from observational studies is increasingly considered to evaluate treatment effects when randomized clinical trials (RCTs) are impractical, as it addresses confounding biases inherent in non-randomized data. Methods such as inverse probability of treatment weighting (IPTW) are widely employed to mitigate these biases. However, IPTW often faces challenges, including issues with extreme weights, sensitivity to unmeasured confounding, and large sample size requirements. Recent advances in neural networks have demonstrated the potential to generate realistic synthetic data that replicate the statistical properties of real-world data. These advances may enhance traditional causal inference methods by creating counterfactual populations. However, the use of synthetic data in causal inference remains largely unexplored. This study aimed to evaluate the adequacy of synthetic data generation for creating counterfactual populations and to compare its performance with IPTW. This approach was applied to evaluate the effect of early prone position on 28-day mortality in mechanically ventilated COVID-19 patients.
Material and Methods
We conducted a simulation study with 2,000 observations, considering a treatment and a binary outcome influenced by confounding factors. Three methods were used to generate datasets of 50,000 synthetic observations: Conditional Tabular Generative Adversarial Network (CTGAN), Realistic Relational and Tabular Data using Transformers (REaLTabFormer), and simpler regression models. Observations with similar propensity scores were sampled from the synthetic dataset to create counterfactual populations, with sample sizes corresponding to inverse probability of treatment weights. The treatment effect was estimated using univariable logistic regression and compared to the true simulated effect. These methods were applied to electronic health records (EHRs) from the “Assistance publique–Hôpitaux de Paris” data warehouse, focusing on COVID-19 patients under mechanical ventilation within 48 hours of admission.
Results
Both REaLTabFormer and regression methods achieved performance broadly similar to that obtained using only the original data with IPTW. CTGAN exhibited higher biases, larger standard errors, and higher type I and type II error rates. The application of these methods to real-world EHR data from mechanically ventilated COVID-19 patients demonstrated the high quality of data generated by the models, with joint distributions of variables closely mimicking those of the original datasets. None of the evaluated methods identified an effect of early prone position on 28-day mortality.
Conclusion
This study highlights the potential of synthetic data generation for creating counterfactual populations, thereby addressing some of the limitations of IPTW. While the evaluated frameworks provided estimates that were at best similar to IPTW, further research is needed in scenarios where IPTW may encounter more limitations, such as small sample sizes or larger numbers of confounding factors. These findings underline both the promise and the challenges of integrating synthetic data into causal inference methods.";https://doi.org/10.1016/j.jeph.2025.203024;"Causality; Observational Studies; Generative Artificial Intelligence; Computer Simulation; Electronic Health Records";Journal of Epidemiology and Population Health;https://www.sciencedirect.com/science/article/pii/S2950433325002186;ScienceDirect;co11.1 - causal inference by generation of synthetic data from electronic health records as an alternative to inverse probability of treatment weighting: a simulation study
Di Zhu;Optimization Method for Spatial Element Layout of Urban Landscape Architecture Based on Generative Algorithm;2025;261;Desconocido;345;353;In urban landscape design, the optimization of spatial layout is very important because it directly affects the functionality, ecological benefits and aesthetic effects of the landscape. This paper introduces a generative algorithm to optimize the layout of garden space elements. It aims to improve the rationality, aesthetics and functionality of the layout scheme through automation and intelligence, so as to better adapt to different environments and user needs. First, a geometric model of the urban landscape space is constructed, and the functional areas, green spaces, water bodies and other elements of the garden are converted into design constraints and objective functions suitable for generative algorithm processing. Then, using genetic algorithm as an optimization tool, through the iterative evolution process of the population, the position, form and combination of spatial elements are gradually adjusted to achieve the predetermined design goals. Finally, the fitness function is introduced to evaluate the pros and cons of each generation of layout schemes, including the openness of the landscape view, the coherence of the functional areas and the aesthetic evaluation. Through multiple iterations, the algorithm gradually converges to the optimal solution and provides a garden layout scheme that meets specific needs. In the layout optimization under complex terrain, the space utilization rate is between 75.0% and 77.8%. The landscape view is distributed between 66.3% and 68.0%, which is relatively evenly distributed. The urban landscape garden space element layout optimization method based on the generative algorithm introduced in this paper not only improves the design efficiency and accuracy but also provides new ideas for urban garden planning.;https://doi.org/10.1016/j.procs.2025.04.213;"Generative Algorithm; Urban Landscape Architecture; Spatial Element Layout Optimization; Landscape Vision";Procedia Computer Science;https://www.sciencedirect.com/science/article/pii/S1877050925013158;ScienceDirect;optimization method for spatial element layout of urban landscape architecture based on generative algorithm
Amar H. Kelkar and Chantal Kerssens and Nicholas Groblewski and Dillon Clancy and Hajime Uno and Dr. Corey Cutler and Danielle Sherman-Manhard and Robert J. Soiffer and Victor HS Wang and Gregory A. Abel;Feasibility of Utilizing a Virtual Health Assistant during Inpatient Reduced-Intensity Allogeneic Transplantation;2024;30;2, Supplement ;S123;S124;"Background
Patients undergoing inpatient allogeneic hematopoietic cell transplantation (HCT) often experience psychological consequences. care.coach AvatarTM is a tablet-based ‘human-in-the-loop’ virtual health assistant (VHA) that uses generative artificial intelligence (AI) to provide psychosocial support. It has improved loneliness, depression, anxiety, hospital delirium, and falls in older adults in the hospital (Bott, J Med Internet Res 2019).
Methods
We adapted the care.coach AvatarTM VHA for inpatient HCT. The VHA engages patients with reminders for hydration, medications, food, or activity; HCT education modules; playing games; playing the news or music; having free-form conversations; going through therapeutic activities and exercises; and practicing mindfulness and guided meditation. Avatar protocols were updated based on feedback from a structured focus group (n=10) of nurse navigators, inpatient HCT nurses, and HCT physicians at the Dana-Farber/Harvard Cancer Center. 7 HCT-specific educational modules were created. A feasibility pilot was performed in 3 sequential cohorts of 6 patients receiving reduced intensity conditioning (RIC) HCT. In the first cohort, patients were given the VHAs without any recommendations for how long to use them. The second cohort was given a recommendation for 30 minutes per day, and the third cohort was offered a $20 gift card for completion of at least 4 modules. Responses were measured through patient surveys and engagement data analysis. Predefined retention rate for feasibility was 67%, a standard for introduction of a novel AI technology (Teresi, Med Care 2022). Dissatisfaction rate for the overall VHA experience was defined as responding “disagree” or “strongly disagree” with recommending the VHA to others.
Results
The study included 18 patients (Table). Retention rate from enrollment to discharge or three weeks (whichever came first) was 78% (95% CI: 52-94%). A post-pilot survey was completed by 16 patients (90%), revealing a dissatisfaction rate of 28%. Dissatisfaction rates decreased from 50% to 20% to 0% across the 3 cohorts. Frequency of completion of the post-pilot survey for the full study was 72% within 1 week of disenrollment, and 90% overall. Average completion rate was 52% for all seven HCT modules in the whole study population. Across cohorts, module completion rates changed from 5% to 88% to 62%, reflecting guidance to patients. VHA functions by most time of usage were music (35%), exercise (20%), and education (15%; Figure).
Conclusions
The pilot study demonstrated the feasibility of implementing the care.coach AvatarTM VHA for inpatient HCT patients. Despite modest dissatisfaction and variability in completion rates, the VHA showed promise in providing HCT education, social, and emotional support for inpatient RIC HCT. Further research is needed, including the potential application for outpatient HCT.";https://doi.org/10.1016/j.jtct.2024.01.011;Desconocido;Transplantation and Cellular Therapy;https://www.sciencedirect.com/science/article/pii/S2666636724000137;ScienceDirect;feasibility of utilizing a virtual health assistant during inpatient reduced-intensity allogeneic transplantation
Desconocido;Contents;2025;12;3;v;vi;Desconocido;https://doi.org/10.1016/S2352-0132(25)00062-6;Desconocido;International Journal of Nursing Sciences;https://www.sciencedirect.com/science/article/pii/S2352013225000626;ScienceDirect;contents
Di Zhu;Optimization Method for Spatial Element Layout of Urban Landscape Architecture Based on Generative Algorithm;2025;261;Desconocido;345;353;In urban landscape design, the optimization of spatial layout is very important because it directly affects the functionality, ecological benefits and aesthetic effects of the landscape. This paper introduces a generative algorithm to optimize the layout of garden space elements. It aims to improve the rationality, aesthetics and functionality of the layout scheme through automation and intelligence, so as to better adapt to different environments and user needs. First, a geometric model of the urban landscape space is constructed, and the functional areas, green spaces, water bodies and other elements of the garden are converted into design constraints and objective functions suitable for generative algorithm processing. Then, using genetic algorithm as an optimization tool, through the iterative evolution process of the population, the position, form and combination of spatial elements are gradually adjusted to achieve the predetermined design goals. Finally, the fitness function is introduced to evaluate the pros and cons of each generation of layout schemes, including the openness of the landscape view, the coherence of the functional areas and the aesthetic evaluation. Through multiple iterations, the algorithm gradually converges to the optimal solution and provides a garden layout scheme that meets specific needs. In the layout optimization under complex terrain, the space utilization rate is between 75.0% and 77.8%. The landscape view is distributed between 66.3% and 68.0%, which is relatively evenly distributed. The urban landscape garden space element layout optimization method based on the generative algorithm introduced in this paper not only improves the design efficiency and accuracy but also provides new ideas for urban garden planning.;https://doi.org/10.1016/j.procs.2025.04.213;"Generative Algorithm; Urban Landscape Architecture; Spatial Element Layout Optimization; Landscape Vision";Procedia Computer Science;https://www.sciencedirect.com/science/article/pii/S1877050925013158;ScienceDirect;optimization method for spatial element layout of urban landscape architecture based on generative algorithm
Aarathi Prasad;Boluwaji Ogunyemi: challenging the status quo for better health;2025;405;10478;534;Desconocido;Desconocido;https://doi.org/10.1016/S0140-6736(25)00249-1;Desconocido;The Lancet;https://www.sciencedirect.com/science/article/pii/S0140673625002491;ScienceDirect;boluwaji ogunyemi: challenging the status quo for better health
Stephany Ivonne {Briones Alvarado} and Katiuska Herminia {Liendo Martínez} and Huáscar {Galindo Guzman} and Francisco {Caballero Segura} and Fernando Pedraza;Granulomatous Lymphocytic Lung Interstitial Disease (GLILD): A Diagnostic Challenge. Report of Three Cases;2024;60;2;110;112;Desconocido;https://doi.org/10.1016/j.arbres.2023.12.003;Desconocido;Archivos de Bronconeumología;https://www.sciencedirect.com/science/article/pii/S0300289623004040;ScienceDirect;granulomatous lymphocytic lung interstitial disease (glild): a diagnostic challenge. report of three cases
Desconocido;Advisory Board and Contents;2023;29;12;i;ii;Desconocido;https://doi.org/10.1016/S1471-4914(23)00244-7;Desconocido;Trends in Molecular Medicine;https://www.sciencedirect.com/science/article/pii/S1471491423002447;ScienceDirect;advisory board and contents
Amar H. Kelkar and Chantal Kerssens and Nicholas Groblewski and Dillon Clancy and Hajime Uno and Dr. Corey Cutler and Danielle Sherman-Manhard and Robert J. Soiffer and Victor HS Wang and Gregory A. Abel;Feasibility of Utilizing a Virtual Health Assistant during Inpatient Reduced-Intensity Allogeneic Transplantation;2024;30;2, Supplement ;S123;S124;"Background
Patients undergoing inpatient allogeneic hematopoietic cell transplantation (HCT) often experience psychological consequences. care.coach AvatarTM is a tablet-based ‘human-in-the-loop’ virtual health assistant (VHA) that uses generative artificial intelligence (AI) to provide psychosocial support. It has improved loneliness, depression, anxiety, hospital delirium, and falls in older adults in the hospital (Bott, J Med Internet Res 2019).
Methods
We adapted the care.coach AvatarTM VHA for inpatient HCT. The VHA engages patients with reminders for hydration, medications, food, or activity; HCT education modules; playing games; playing the news or music; having free-form conversations; going through therapeutic activities and exercises; and practicing mindfulness and guided meditation. Avatar protocols were updated based on feedback from a structured focus group (n=10) of nurse navigators, inpatient HCT nurses, and HCT physicians at the Dana-Farber/Harvard Cancer Center. 7 HCT-specific educational modules were created. A feasibility pilot was performed in 3 sequential cohorts of 6 patients receiving reduced intensity conditioning (RIC) HCT. In the first cohort, patients were given the VHAs without any recommendations for how long to use them. The second cohort was given a recommendation for 30 minutes per day, and the third cohort was offered a $20 gift card for completion of at least 4 modules. Responses were measured through patient surveys and engagement data analysis. Predefined retention rate for feasibility was 67%, a standard for introduction of a novel AI technology (Teresi, Med Care 2022). Dissatisfaction rate for the overall VHA experience was defined as responding “disagree” or “strongly disagree” with recommending the VHA to others.
Results
The study included 18 patients (Table). Retention rate from enrollment to discharge or three weeks (whichever came first) was 78% (95% CI: 52-94%). A post-pilot survey was completed by 16 patients (90%), revealing a dissatisfaction rate of 28%. Dissatisfaction rates decreased from 50% to 20% to 0% across the 3 cohorts. Frequency of completion of the post-pilot survey for the full study was 72% within 1 week of disenrollment, and 90% overall. Average completion rate was 52% for all seven HCT modules in the whole study population. Across cohorts, module completion rates changed from 5% to 88% to 62%, reflecting guidance to patients. VHA functions by most time of usage were music (35%), exercise (20%), and education (15%; Figure).
Conclusions
The pilot study demonstrated the feasibility of implementing the care.coach AvatarTM VHA for inpatient HCT patients. Despite modest dissatisfaction and variability in completion rates, the VHA showed promise in providing HCT education, social, and emotional support for inpatient RIC HCT. Further research is needed, including the potential application for outpatient HCT.";https://doi.org/10.1016/j.jtct.2024.01.011;Desconocido;Transplantation and Cellular Therapy;https://www.sciencedirect.com/science/article/pii/S2666636724000137;ScienceDirect;feasibility of utilizing a virtual health assistant during inpatient reduced-intensity allogeneic transplantation
Gerard T. Hogan;Pain Psychology;2025;Desconocido;Desconocido;Desconocido;Desconocido;Desconocido;https://doi.org/10.1016/j.cnur.2025.01.011;"Chronic pain; Central sensitization; Cognitive behavioral therapy; Fear avoidance; Biopsychosocial approach";Nursing Clinics of North America;https://www.sciencedirect.com/science/article/pii/S0029646525000131;ScienceDirect;pain psychology
Desconocido;Contents;2025;12;3;v;vi;Desconocido;https://doi.org/10.1016/S2352-0132(25)00062-6;Desconocido;International Journal of Nursing Sciences;https://www.sciencedirect.com/science/article/pii/S2352013225000626;ScienceDirect;contents
Aarathi Prasad;Boluwaji Ogunyemi: challenging the status quo for better health;2025;405;10478;534;Desconocido;Desconocido;https://doi.org/10.1016/S0140-6736(25)00249-1;Desconocido;The Lancet;https://www.sciencedirect.com/science/article/pii/S0140673625002491;ScienceDirect;boluwaji ogunyemi: challenging the status quo for better health
Stephany Ivonne {Briones Alvarado} and Katiuska Herminia {Liendo Martínez} and Huáscar {Galindo Guzman} and Francisco {Caballero Segura} and Fernando Pedraza;Granulomatous Lymphocytic Lung Interstitial Disease (GLILD): A Diagnostic Challenge. Report of Three Cases;2024;60;2;110;112;Desconocido;https://doi.org/10.1016/j.arbres.2023.12.003;Desconocido;Archivos de Bronconeumología;https://www.sciencedirect.com/science/article/pii/S0300289623004040;ScienceDirect;granulomatous lymphocytic lung interstitial disease (glild): a diagnostic challenge. report of three cases
Desconocido;Advisory Board and Contents;2023;29;12;i;ii;Desconocido;https://doi.org/10.1016/S1471-4914(23)00244-7;Desconocido;Trends in Molecular Medicine;https://www.sciencedirect.com/science/article/pii/S1471491423002447;ScienceDirect;advisory board and contents
Gerard T. Hogan;Pain Psychology;2025;Desconocido;Desconocido;Desconocido;Desconocido;Desconocido;https://doi.org/10.1016/j.cnur.2025.01.011;"Chronic pain; Central sensitization; Cognitive behavioral therapy; Fear avoidance; Biopsychosocial approach";Nursing Clinics of North America;https://www.sciencedirect.com/science/article/pii/S0029646525000131;ScienceDirect;pain psychology
Mohammad Amin Roshani and Xiangyu Zhou and Yao Qiang and Srinivasan Suresh and Steven Hicks and Usha Sethuraman and Dongxiao Zhu;Generative Large Language Model—Powered Conversational AI App for Personalized Risk Assessment: Case Study in COVID-19;2025;4;Desconocido;Desconocido;Desconocido;"Background
Large language models (LLMs) have demonstrated powerful capabilities in natural language tasks and are increasingly being integrated into health care for tasks like disease risk assessment. Traditional machine learning methods rely on structured data and coding, limiting their flexibility in dynamic clinical environments. This study presents a novel approach to disease risk assessment using generative LLMs through conversational artificial intelligence (AI), eliminating the need for programming.
Objective
This study evaluates the use of pretrained generative LLMs, including LLaMA2-7b and Flan-T5-xl, for COVID-19 severity prediction with the goal of enabling a real-time, no-code, risk assessment solution through chatbot-based, question-answering interactions. To contextualize their performance, we compare LLMs with traditional machine learning classifiers, such as logistic regression, extreme gradient boosting (XGBoost), and random forest, which rely on tabular data.
Methods
We fine-tuned LLMs using few-shot natural language examples from a dataset of 393 pediatric patients, developing a mobile app that integrates these models to provide real-time, no-code, COVID-19 severity risk assessment through clinician-patient interaction. The LLMs were compared with traditional classifiers across different experimental settings, using the area under the curve (AUC) as the primary evaluation metric. Feature importance derived from LLM attention layers was also analyzed to enhance interpretability.
Results
Generative LLMs demonstrated strong performance in low-data settings. In zero-shot scenarios, the T0-3b-T model achieved an AUC of 0.75, while other LLMs, such as T0pp(8bit)-T and Flan-T5-xl-T, reached 0.67 and 0.69, respectively. At 2-shot settings, logistic regression and random forest achieved an AUC of 0.57, while Flan-T5-xl-T and T0-3b-T obtained 0.69 and 0.65, respectively. By 32-shot settings, Flan-T5-xl-T reached 0.70, similar to logistic regression (0.69) and random forest (0.68), while XGBoost improved to 0.65. These results illustrate the differences in how generative LLMs and traditional models handle the increasing data availability. LLMs perform well in low-data scenarios, whereas traditional models rely more on structured tabular data and labeled training examples. Furthermore, the mobile app provides real-time, COVID-19 severity assessments and personalized insights through attention-based feature importance, adding value to the clinical interpretation of the results.
Conclusions
Generative LLMs provide a robust alternative to traditional classifiers, particularly in scenarios with limited labeled data. Their ability to handle unstructured inputs and deliver personalized, real-time assessments without coding makes them highly adaptable to clinical settings. This study underscores the potential of LLM-powered conversational artificial intelligence (AI) in health care and encourages further exploration of its use for real-time, disease risk assessment and decision-making support.";https://doi.org/10.2196/67363;"personalized risk assessment; large language model; conversational AI; artificial intelligence; COVID-19";JMIR AI;https://www.sciencedirect.com/science/article/pii/S2817170525000213;ScienceDirect;generative large language model—powered conversational ai app for personalized risk assessment: case study in covid-19
Anna Guillaumet;The power of generative AI for CRIS systems: a new paradigm for scientific information management;2024;249;Desconocido;131;149;The paper analyses the implications of the emergence of artificial intelligence (AI), especially generative AI, on current research information systems (CRIS). It reviews the recent European regulations for high-risk AI systems, the Spanish AI strategy, and the IntelComp project as use cases. The study found that the maturity of CRIS systems, coupled with the increasing complexity due to data aggregation, sets the stage for innovative AI applications. The paper proposes key domains where AI can impact and be applied in CRIS, including data management, research assessment, and advanced analytics. It also provides examples of how generative AI can be leveraged to enhance scientific information management within CRIS. The findings highlight the need to ensure the responsible and ethical development of AI technologies in the research domain.;https://doi.org/10.1016/j.procs.2024.11.057;"CRIS; AI; GenerativeAI; euroCRIS; FECYT; DRIS; OpenAccess; Research; CERIF; FAIR; AI-Act; ENIA; Sandbox; Law; Regulations; Standards; ethics";Procedia Computer Science;https://www.sciencedirect.com/science/article/pii/S187705092403268X;ScienceDirect;the power of generative ai for cris systems: a new paradigm for scientific information management
Desconocido;Table of Content;2025;22;2;A1;A4;Desconocido;https://doi.org/10.1016/S1546-1440(25)00039-0;Desconocido;Journal of the American College of Radiology;https://www.sciencedirect.com/science/article/pii/S1546144025000390;ScienceDirect;table of content
