Authors;Title;Year;Volume;Issue;Start Page;End Page;Abstract;DOI;Author Keywords;Publication Title;Link;Database;Title_lower
Kelci C. Davis and Nicholas Kavish and Jaime L. Anderson;The personal cost of psychopathy: Impacts of triarchic psychopathy traits on impairment, internalizing, and life satisfaction;2024;219;Desconocido;112507;Desconocido;"Although psychopathic traits have long been acknowledged as a public health concern, a growing body of evidence suggests there is a significant personal cost to living with psychopathy. However, much of the current literature on psychopathy impairment appears mixed in findings, varying by the traits examined and measured outcomes. The current paper aims to contribute to this field of research by examining how a triarchic model of psychopathy relates to a wide variety of potential consequences, including impairment, personality functioning, interpersonal functioning, internalizing, and perceived quality of life. Through two studies utilizing the Triarchic psychopathy model in undergraduate samples, significant psychopathy impairment was identified. Broadly, disinhibition was related to the most significant impairments across functioning domains. Boldness was more variable and elicited both positive (e.g., higher quality of life, lower self-harm) and negative (impairments in empathy and intimacy) outcomes. Meanness was primarily related to interpersonal difficulties; however, differences in measuring meanness led to different findings on its connection to personality functioning. By better understanding the consequences of psychopathy and how they vary by dimensional traits, interventions can be better tailored to alleviate both individual and societal suffering.";https://doi.org/10.1016/j.paid.2023.112507;"Psychopathy; Personality psychopathology; Triarchic model; Impairment; Internalizing; Quality of life";Personality and Individual Differences;https://www.sciencedirect.com/science/article/pii/S0191886923004300;ScienceDirect;the personal cost of psychopathy: impacts of triarchic psychopathy traits on impairment, internalizing, and life satisfaction
Cathleen Biga and B. Hadley Wilson;Realizing Our Vision: ACC’s Next 5-Year Strategic Plan;2024;83;15;1489;1491;Desconocido;https://doi.org/10.1016/j.jacc.2024.03.366;Desconocido;Journal of the American College of Cardiology;https://www.sciencedirect.com/science/article/pii/S0735109724009148;ScienceDirect;realizing our vision: acc’s next 5-year strategic plan
Hao Fong Sit and Wen Chen and Dan Wu and Yangmu Huang and Dong (Roman) Xu and Brian J Hall;Digital mental health: a potential opportunity to improve health equity in China;2024;9;12;e1136;e1141;"Summary
Mental health is an important public health issue in China, compounded by a shortage in psychiatric services. Against this backdrop, digital technologies could offer solutions. Digital mental health interventions use technologies, such as smartphone applications, to improve mental health outcomes. Although there has been a drastic increase in mental health mobile apps available in recent years, current evidence-based digital interventions for mental health are scarce and seldom evaluated for effectiveness and implementation in China. In this Viewpoint, we review digital mental health interventions in China and propose a framework that could guide the development of culturally sensitive digital mental health innovations, with the adoption of co-creation and community engagement strategies. We also provide recommendations to address issues related to usage, interventions, and implementation to improve health equity and implementation of digital mental health interventions in the Chinese context.";https://doi.org/10.1016/S2468-2667(24)00249-4;Desconocido;The Lancet Public Health;https://www.sciencedirect.com/science/article/pii/S2468266724002494;ScienceDirect;digital mental health: a potential opportunity to improve health equity in china
Tianlong Shan and Fan Zhang and Albert P.C. Chan and Shiyao Zhu and Kaijian Li;Large language Models-empowered automatic knowledge graph development based on multi-modal data for building health resilience;2025;68;Desconocido;103655;Desconocido;Improving the health resilience of building (BHR) helps keep stable health status of both the building and its occupants under disasters. As BHR is an emerging concept, there is no structured knowledge graph to understand the whole process of BHR under disasters. Therefore, this study aims to build a structured BHR knowledge graph based on multi-modal data, providing sufficient structured knowledge for BHR enhancement. An automated knowledge graph construction approach is proposed to empower the ontology design and triple extraction by large language models (LLMs), and validation processes based on In-context Learning (ICL) prompts. A case study is conducted to construct the knowledge graph of BHR under rainstorms in Hong Kong. The performance of the proposed LLMs-empowered knowledge extraction is also validated based on natural language processing metrics and LLMs-based Evaluation (LLMs-Eval). BHR knowledge graph indicates the potential relations between disasters, factors, response actions, and the health status of the building and occupants, and provides insight to guide the BHR enhancement. The superiority of the proposed LLMs-empowered automated knowledge graph construction approach is proven, implying LLMs have great potential in knowledge graph construction, not only for BHR but also for other concepts that require structured knowledge for further explorations and analyses.;https://doi.org/10.1016/j.aei.2025.103655;"Building health resilience; Knowledge graph; Large language models; Multi-modal data; Rainstorm";Advanced Engineering Informatics;https://www.sciencedirect.com/science/article/pii/S1474034625005488;ScienceDirect;large language models-empowered automatic knowledge graph development based on multi-modal data for building health resilience
Rasmus Haunstrup Døssing and Julia Johanna {Almer Bromann} and Karina Seierøe and Estrid Høgdall and Tim Svenstrup Poulsen and Jakob Hagen {Vasehus Schou} and Dan Høgdall;The value of MMR characterization and efficacy of checkpoint inhibitor in patients with small-bowel adenocarcinomas. A retrospective real-world cohort study;2025;Desconocido;Desconocido;100030;Desconocido;"Background
Small bowel adenocarcinoma (SBA) is a rare gastrointestinal malignancy with poor prognosis and limited treatment options. Given its rarity, clinical management often mirrors colorectal cancer dCRC), despite distinct molecular features and inferior outcomes. Although checkpoint inhibitor (CPI) therapy has shown efficacy in mismatch repair-deficient (dMMR) CRC, data in SBA remain scarce, and MMR testing is not routinely implemented.
Methods
We conducted a retrospective study of SBA patients treated with CPI at Copenhagen University Hospital – Herlev between March 2019 and January 2024. Radiological responses were assessed using RECIST v1.1. We also analyzed the frequency of MMR testing and dMMR status in SBA patients.
Results
Among 148 SBA patients, seven received CPI therapy. The objective response rate (ORR) was 86%, with one (14%) complete response (CR) and five (71%) partial responses (PR). Median progression-free survival (mPFS) was 31 months (mFU:32 months); median overall survival (mOS) was not reached (mFU: 33 months). Overall, 55% underwent MMR testing, and 18% of SBA patients were dMMR.
Conclusion
CPI therapy yields high, durable response rates in dMMR SBA, supporting dMMR as a predictive biomarker. However, inconsistent MMR testing strategy may limit access to optimal treatment. Routine molecular profiling and broader biomarker discovery are key to expanding CPI eligibility and improving outcomes.";https://doi.org/10.1016/j.esmorc.2025.100030;"Small bowel adenocarcinoma; mismatch repair-deficient; MMR testing; Checkpoint inhibitors";ESMO Rare Cancers;https://www.sciencedirect.com/science/article/pii/S3050461925000292;ScienceDirect;the value of mmr characterization and efficacy of checkpoint inhibitor in patients with small-bowel adenocarcinomas. a retrospective real-world cohort study
Wei Dai and Yi-Shan Tsai and Jionghao Lin and Ahmad Aldino and Hua Jin and Tongguang Li and Dragan Gašević and Guanliang Chen;Assessing the proficiency of large language models in automatic feedback generation: An evaluation study;2024;7;Desconocido;100299;Desconocido;Assessment feedback is important to student learning. Learning analytics (LA) powered by artificial intelligence exhibits profound potential in helping instructors with the laborious provision of feedback. Inspired by the recent advancements made by Generative Pre-trained Transformer (GPT) models, we conducted a study to examine the extent to which GPT models hold the potential to advance the existing knowledge of LA-supported feedback systems towards improving the efficiency of feedback provision. Therefore, our study explored the ability of two versions of GPT models – i.e., GPT-3.5 (ChatGPT) and GPT-4 – to generate assessment feedback on students' writing assessment tasks, common in higher education, with open-ended topics for a data science-related course. We compared the feedback generated by GPT models (namely GPT-3.5 and GPT-4) with the feedback provided by human instructors in terms of readability, effectiveness (content containing effective feedback components), and reliability (correct assessment on student performance). Results showed that (1) both GPT-3.5 and GPT-4 were able to generate more readable feedback with greater consistency than human instructors, (2) GPT-4 outperformed GPT-3.5 and human instructors in providing feedback containing information about effective feedback dimensions, including feeding-up, feeding-forward, process level, and self-regulation level, and (3) GPT-4 demonstrated higher reliability of feedback compared to GPT-3.5. Based on our findings, we discussed the potential opportunities and challenges of utilising GPT models in assessment feedback generation.;https://doi.org/10.1016/j.caeai.2024.100299;"Assessment feedback; Learning analytics; Feedback generation; Generative pre-trained transformer; Feedback effectiveness; Automated feedback system";Computers and Education: Artificial Intelligence;https://www.sciencedirect.com/science/article/pii/S2666920X24001024;ScienceDirect;assessing the proficiency of large language models in automatic feedback generation: an evaluation study
Shihua Gao and Zhikun Zhuang and Changyu Huang and Qiushi Wei and Wei He and Tiantian Xia and Ziqi Li;Predicting Progression of Traumatic Osteonecrosis of the Femoral Head Based on Magnetic Resonance Imaging Classification: A Retrospective Cohort Study;2025;Desconocido;Desconocido;Desconocido;Desconocido;"Background
The purpose of our study was to develop a novel magnetic resonance imaging classification system to predict the progression of traumatic osteonecrosis of the femoral head (TONFH) in young adults and assess its clinical implications.
Methods
A retrospective cohort study was conducted from January 2007 to December 2022, including 134 hips (134 patients, mean age 41 years (range, 21 to 43), 65.7% men) diagnosed with TONFH at Association Research Circulation Osseous Stage I. The bone repair band (BRB) classification system categorized lesions into Superficial (Type S), Uncertain (Type U), and Extensive (Type E) based on magnetic resonance imaging coronal views. Patients were followed with observational treatment and x-ray assessments. Radiographic signs and femoral head collapse were evaluated during follow-up. Survival analysis and Cox proportional hazards regression assessed the association between BRB classification and disease progression.
Results
The 134 hips were categorized into Type S (n = 54), Type U (n = 21), and Type E (n = 59). Over a mean follow-up of 39.6 months, radiographic signs were most prevalent in Type E (94.9%) and least in Type S (9.3%), with median times to radiographic signs of 18 months for Type U and 16 months for Type E. Femoral head collapse occurred in 50.8% of Type E, 23.8% of Type U, and none in Type S, with a median time to collapse of 34 months for Type E. Both univariate and multivariate analyses identified BRB classification as an independent predictor of disease progression, with Type E showing the highest risk for adverse outcomes.
Conclusions
The newly proposed BRB classification provides a systematic approach to assessing necrotic lesion severity in TONFH and demonstrates significant correlation with femoral head collapse risk. Future studies are needed to further validate its clinical significance and explore the anatomical basis underlying this classification.";https://doi.org/10.1016/j.arth.2025.06.030;"traumatic osteonecrosis of the femoral head; ARCO classification; femoral head collapse; BRB classification; progression";The Journal of Arthroplasty;https://www.sciencedirect.com/science/article/pii/S0883540325007090;ScienceDirect;predicting progression of traumatic osteonecrosis of the femoral head based on magnetic resonance imaging classification: a retrospective cohort study
Alessandro Fiocchi and Bryan Martin and Gary Wing-Kin Wong and Motohiro Ebisawa and Lucia {Lo Scalzo} and Francesca Galletta and Stefania Arasi and Ignacio J. Ansotegui and Maryam Ali {Al-Nesf Al-Mansouri} and Sandra N. {Gónzalez Díaz} and Jonathan A. Bernstein and Elham Hossny and Hiroshi Chantaphakul and Luciana K. Tanno and Tinatin Chikovani and David M. Lang and Luz Fonacier and Hideaki Morita and Mary Beth Fasano and José Antonio Ortega-Martell and Pedro Giavina-Bianchi and Nikolaos G. Papadopoulos and R. Maximiliano Gómez and Mário Morais Almeida;A World Allergy Organization (WAO) manifesto for the worldwide approval of biologic therapies for food allergy;2025;18;10;101113;Desconocido;Desconocido;https://doi.org/10.1016/j.waojou.2025.101113;"Food hypersensitivity; Epidemiology; Anaphylaxis; Biologics; Drug approval process; Biological therapies";World Allergy Organization Journal;https://www.sciencedirect.com/science/article/pii/S1939455125000900;ScienceDirect;a world allergy organization (wao) manifesto for the worldwide approval of biologic therapies for food allergy
Niina Hynninen;The Language of Interaction in English as a Lingua Franca;2024;Desconocido;Desconocido;Desconocido;Desconocido;Interaction in English as a lingua franca (ELF) has become a commonplace phenomenon. This article revisits research on ELF to discuss what it means for speakers to operate in different types of ELF interactions and how ELF use is impacting on the forms of English. Findings suggest, for instance, the importance of accommodation and enhanced explicitness in spoken ELF interaction as means to increase the effectiveness of communication. Despite the variability of ELF, there is also evidence for renewed preference patterns in ELF use, and even some indication of ELF impact on functional varieties of English.;https://doi.org/10.1016/B978-0-323-95504-1.00290-8;"Accommodation; ELF; English as a lingua franca; Explicitness; Interaction; Language contact; Misunderstanding; Similect; Transient; Variation";Reference Module in Social Sciences;https://www.sciencedirect.com/science/article/pii/B9780323955041002908;ScienceDirect;the language of interaction in english as a lingua franca
Chris Palmer;Unprecedented Collaboration Plots Largest, Most Detailed Maps of the Brain;2024;39;Desconocido;7;9;Desconocido;https://doi.org/10.1016/j.eng.2024.07.004;Desconocido;Engineering;https://www.sciencedirect.com/science/article/pii/S2095809924003928;ScienceDirect;unprecedented collaboration plots largest, most detailed maps of the brain
Guanhong Yao and WuJi Zhang and Yingxi Zhu and Ut-kei Wong and Yanfeng Zhang and Cui Yang and Guanghao Shen and Zhanguo Li and Hui Gao;Comparing the accuracy of large language models and prompt engineering in diagnosing realworld cases;2025;203;Desconocido;106026;Desconocido;"Importance
Large language models (LLMs) hold potential in clinical decision-making, especially for complex and rare disease diagnoses. However, real-world applications require further evaluation for accuracy and utility.
Objective
To evaluate the diagnostic performance of four LLMs (GPT-4o mini, GPT-4o, ERNIE, and Llama-3) using real-world inpatient medical records and assess the impact of different prompt engineering methods.
Method
This single-center, retrospective study was conducted at Peking University International Hospital. It involved 1,122 medical records categorized into common rheumatic autoimmune diseases, rare rheumatic autoimmune diseases, and non-rheumatic diseases. Four LLMs were evaluated using two prompt engineering methods: few-shot and chain-of-thought prompting. Diagnostic accuracy (hit1) was defined as the inclusion of the first final diagnosis from the medical record in the model’s top prediction.
Results
Hit1 of four LLMs were as follows: GPT-4omini (81.8 %), GPT-4o (82.4 %), ERNIE (82.9 %) and Llama-3 (82.7 %). Few-shot prompting significantly improved GPT-4o’s hit1 (85.9 %) compared to its base model (p = 0.02), outperforming other models (all p < 0.05). Chain-of-thought prompting showed no significant improvement. Hit1 for both common and rare rheumatic diseases was consistently higher than that for non-rheumatic disease. Few-shot prompting increased costs per correct diagnosis for GPT-4o by approximately ¥4.54.
Conclusions
LLMs, including GPT-4o, demonstrate promising diagnostic accuracy on real medical records. Few-shot prompting enhances performance but at higher costs, underscoring the need for accuracy improvements and cost management. These findings inform LLM development in Chinese medical contexts and highlight the necessity for further multi-center validation.";https://doi.org/10.1016/j.ijmedinf.2025.106026;"Large Language Models; LLMs; Prompt Engineering; Accuracy; Rheumatic Disease; Realworld";International Journal of Medical Informatics;https://www.sciencedirect.com/science/article/pii/S1386505625002436;ScienceDirect;comparing the accuracy of large language models and prompt engineering in diagnosing realworld cases
K.P. Karthik and Arun Kumar Mahapatra and Prashant Kumar Gupta and S. Rajagopala;Proposed clinical algorithm for hematinic bhasmas selection for Ayurvedic pediatric care;2024;15;6;100972;Desconocido;Ayurveda has unique and relevant methods in nosology, symptomatology, and drug selection. These methods need a novel and effective way of presentation for convenient comprehension and implementation. ‘Clinical algorithms’ is one such way, wherein a large amount of data is simplified, conceptual intricacies abstracted, and clinical application made easier. This article uses a modified version of the Horabin and Lewis algorithm to construct a clinical algorithm for Bhasma selection in the management of Pandu (anemia). The textual descriptions regarding the pathology and clinical presentations of Pandu have been compiled, and broadly classified, and the Bhasmas indication in suit each set of disease presentation has been specified. The algorithm is validated and optimized at single centre, while multicentre implementations and post-hoc modifications are warranted.;https://doi.org/10.1016/j.jaim.2024.100972;"Hematinics; Ayurveda; Bhasmas";Journal of Ayurveda and Integrative Medicine;https://www.sciencedirect.com/science/article/pii/S0975947624000871;ScienceDirect;proposed clinical algorithm for hematinic bhasmas selection for ayurvedic pediatric care
Jared Reid and Matthew McCrosson and Jacqueline Tobin and Gabriella Rivas and Stacey Rothwell and Langdon Hartsock and Kristoff Reid;Opportunistic CT screening demonstrates increased risk for peri-articular fractures in osteoporotic patients;2024;110;8;103935;Desconocido;"Background
Underdiagnosis or undertreatment of osteoporosis consequently impacts individual morbidity and mortality, as well as on healthcare systems and communities as a whole. Dual-energy x-ray absorptiometry (DXA) is the gold standard method for identifying osteoporosis, however, opportunistic CT screening is capable of precisely estimating bone mineral density (BMD) in abdominopelvic imaging with no additional cost, radiation exposure or inconvenience to patients. This study uses opportunistic CT screening to determine the prevalence of osteoporosis and anatomic distribution patterns in patients presenting with lower extremity fractures at our institution.
Hypothesis
Trauma patients with low bone mineral density (BMD) are more likely to present with peri-articular versus shaft fractures.
Patients and methods
We conducted a retrospective review of 721 patients presenting as trauma activations to the emergency department (ED) of a Level 1 Trauma Center with lower extremity fractures. Patients were excluded if under the age of 18 or lacking a CT scan upon arrival in the ED. Hounsfield Units (HU) were measured at the L1 vertebral level on CT scans to determine bone mineral density. Values of ≤100 HU were consistent with osteoporosis, whereas 101–150 HU were consistent with osteopenia.
Results
The final cohort included 416 patients, with mean age of 49 ± 21 years. Average bone density was 203.9 ± 73.4 HU. 15.9% of patients were diagnosed as osteopenic and 9.9% as osteoporotic. 64.2% of fractures were peri-articular, 25.7% were shaft, and 10.1% were a combination. Peri-articular fractures were significantly more likely to have lower average BMD than shaft fractures (189 ± 74.7 HU vs. 230.6 ± 66.1 HU, p < 0.001).
Discussion
Our study demonstrates a significant relationship between low bone mineral density and lower extremity fracture pattern, however, likely influenced by other factors such as sex. Opportunistic CT screening for osteoporosis in trauma settings provides ample opportunity for early detection of low BMD and implementation of highly effective lifestyle modification and pharmacotherapy intervention. Reduction in the overall incidence of peri-articular fracture with widespread adoption of opportunistic CT screening may lessen the morbidity, mortality, and total cost currently afflicting patients, healthcare systems, and communities.
Level of evidence
III, therapeutic";https://doi.org/10.1016/j.otsr.2024.103935;"Osteoporosis; Opportunistic CT scan; Peri-articular fracture; Fragility fracture";Orthopaedics & Traumatology: Surgery & Research;https://www.sciencedirect.com/science/article/pii/S1877056824001919;ScienceDirect;opportunistic ct screening demonstrates increased risk for peri-articular fractures in osteoporotic patients
DU Qing;Quantitative determination of coptisine and berberine hydrochloride in Corydalis conspersa by high-performance liquid chromatography and quality evaluation;2025;Desconocido;Desconocido;100620;Desconocido;The key active ingredients of Chinese medicinal materials are often used as indicators in quality standards. Corydalis conspersa is a characteristic plant from the Qinghai-Tibet plateau and contains various of isoquinoline alkaloids. Water content was determinated from diverse parts of Corydalis conspersa according to the Chinese Pharmacopoeia. The component of coptisine and berberine hydrochloride in Corydalis conspersa were extracted using the solvent of methanol-hydrochloric acid and detected by High-Performance Liquid Chromatography. The results of method validation test was stable and reliable. The content of coptisine and berberine hydrochloride in root samples was higher than in herbs. In the sample solutions of stem and leaf, only coptisine was detectable. Thus, the levels of coptisine and berberine hydrochloride in root and herbs can serve as a qualified basis for quality standards of Corydalis conspersa.;https://doi.org/10.1016/j.cjac.2025.100620;"Corydalis conspersa; coptisine; berberine hydrochloride; diverse parts; content comparison";Chinese Journal of Analytical Chemistry;https://www.sciencedirect.com/science/article/pii/S187220402500129X;ScienceDirect;quantitative determination of coptisine and berberine hydrochloride in corydalis conspersa by high-performance liquid chromatography and quality evaluation
